{
  "job_id": "22222222-2222-4222-8222-222222222222",
  "repository_id": "11111111-1111-4111-8111-111111111111",
  "status": "succeeded",
  "attempts": 1,
  "progress_percent": 100,
  "commit_sha": "0123456789abcdef0123456789abcdef01234567",
  "failure_code": null,
  "created_at": "2026-09-16T12:00:00Z",
  "updated_at": "2026-09-16T12:00:00Z"
}
